<!ELEMENT SUB-ELEMENTO (#PCDATA | A | B | C)*>
<!ELEMENT PRINCIPAL ((ELEMENTO+))>
<!ELEMENT ELEMENTO (#PCDATA | SUB-ELEMENTO)*>
<!ELEMENT C ANY>
<!ELEMENT B ANY>
<!ELEMENT A ANY>
