<!DOCTYPE PRINCIPAL SYSTEM "DTDAny02.dtd">
<PRINCIPAL>
	<ELEMENTO>
		<SUB-ELEMENTO>
			<A/>
			<B/>
			<C/>
		</SUB-ELEMENTO>
	</ELEMENTO>
	<ELEMENTO>
		<SUB-ELEMENTO>
			<A/>
			<B/>
		</SUB-ELEMENTO>
	</ELEMENTO>
	<ELEMENTO>
		<SUB-ELEMENTO>		
		</SUB-ELEMENTO>
	</ELEMENTO>
	<ELEMENTO>
	</ELEMENTO>
</PRINCIPAL>
